<?xml version="1.1" encoding="ISO-8859-1"?>
<!DOCTYPE expr SYSTEM "expr.dtd">
<expr>
  <add>
    <expr>
      <ID>
	var1
      </ID>
    </expr>
    <expr>
      <add>
	<expr>
	  <ID>
	    var1
	  </ID>
	</expr>
      </add>
    </expr>
  </add>
</expr>