<?xml version="1.1" encoding="ISO-8859-1"?>
<!DOCTYPE expr SYSTEM "expr.dtd">
<expr>
  <add>
    <expr>
      <NUMBER>
	3
      </NUMBER>
    </expr>
    <expr>
      <mult>
	<expr>
	  <NUMBER>
	    3
	  </NUMBER>
	</expr>
	<expr>
	  <NUMBER>
	    4
	  </NUMBER>
	</expr>
      </mult>
    </expr>
  </add>
</expr>